{
  "api_version": "shanhai.edu/v1",
  "kind": "prompt_template",
  "metadata": {
    "key": "video.master_script.generate.prompt",
    "name": "视频母版剧本生成业务Prompt",
    "domain": "primary_math",
    "locale": "zh-CN"
  },
  "spec": {
    "template_key": "video.master_script.generate.prompt",
    "title": "视频母版剧本生成业务Prompt",
    "description": "只从已选课程驱动导入方案的不可变快照扩写完整短片剧本，并准确停在课堂交接时刻。",
    "model_capability": "text.structured.creative_video",
    "input_definition_ref": {
      "item_key": "video.master_script.generate.input",
      "kind": "input_definition"
    },
    "output_definition_ref": {
      "item_key": "video.master_script.generate.output",
      "kind": "content_definition"
    },
    "sections": [
      {
        "section_key": "role",
        "layer": "role",
        "content": "你是课程驱动课堂导入短片的母版编剧，负责把已选方案扩写为完整可生产故事。",
        "editable": false,
        "visible_to_teacher": true
      },
      {
        "section_key": "task",
        "layer": "task",
        "content": "严格继承已选方案的标题、独立概念、钩子、课程锚点、课堂第一问、交接时刻和不得提前讲授内容，生成完整故事与场次，并给出60至180秒内的时长建议。不得重新选择创意，不得读取或推测教案、教材、PPT。此阶段不要写shot级提示词或臆造价格。",
        "editable": true,
        "visible_to_teacher": true
      },
      {
        "section_key": "method",
        "layer": "method",
        "content": "从已选快照的creative_concept、hook、viewer_value、knowledge_point和course_anchor展开故事，使课程依据贯穿故事起点、变化与课堂交接，而不是在结尾临时贴入。每个场次写明目的、地点、人物或主体、动作、旁白、对白、声音意图、开始和结束状态及预计时长。根据故事场次、可见节拍、预计镜头数、节奏和交接点推荐60至180秒内的精确总时长；teacher_fixed时尊重教师目标，system_recommended时使用建议值。价格由服务端当前路由和版本化价格档案另行估算，模型只声明需要报价，不输出金额。",
        "editable": false,
        "visible_to_teacher": false
      },
      {
        "section_key": "quality_gate",
        "layer": "quality_gate",
        "content": "已选快照中的课程驱动创意、钩子、观看价值、课程关联和交接字段不得改写；完整故事不是梗概或shot列表；结尾准确停在handoff_moment；不得解释must_not_preteach；建议时长和最终目标均在60至180秒，场次时长总和等于目标时长；建议理由与预计镜头数可复核；不包含Provider、模型、参考图位置、虚构费用、自动批准或下一工具。",
        "editable": false,
        "visible_to_teacher": false
      }
    ],
    "context_bindings": [
      {
        "binding_key": "selected_intro",
        "source": "intro_selection.snapshot",
        "required": true,
        "exposure": "full",
        "max_items": 1,
        "max_bytes": 100000
      }
    ],
    "user_edit_policy": {
      "mode": "replace_editable_layer",
      "max_chars": 40000
    }
  }
}
