{
  "api_version": "shanhai.edu/v1",
  "kind": "projection_template",
  "metadata": {
    "key": "ppt.body_assets.generate.projection",
    "name": "PPT正文图片生成教师投影",
    "domain": "primary_math",
    "locale": "zh-CN"
  },
  "spec": {
    "projection_key": "ppt.body_assets.generate.projection",
    "title": "PPT正文图片生成教师投影",
    "source_definition_ref": {
      "item_key": "ppt.body_assets.generate.output",
      "kind": "content_definition"
    },
    "output_format": "markdown",
    "renderer_id": "shanhai.image_collection.markdown.v1",
    "template": "# PPT正文图片生成结果\n\n{{body_generated_items}}\n\n## 覆盖检查\n{{body_generation_coverage}}",
    "allowed_variables": [
      "body_generated_items",
      "body_generation_coverage"
    ],
    "teacher_visible": true
  }
}
