{
  "api_version": "shanhai.edu/v1",
  "kind": "content_definition",
  "metadata": {
    "key": "video.asset_inventory.generate.output",
    "name": "视频四类资产清单输出",
    "domain": "primary_math",
    "locale": "zh-CN"
  },
  "spec": {
    "definition_key": "video.asset_inventory.generate.output",
    "title": "视频四类资产清单输出",
    "description": "四类资产及其来源、用途、去重身份和固定槽位。",
    "definition_role": "artifact",
    "fields": [
      {
        "field_key": "asset_inventory_key",
        "label": "资产清单键",
        "type": "text",
        "required": true,
        "editable": false,
        "deletable": false
      },
      {
        "field_key": "video_assets",
        "label": "视频图片资产",
        "type": "repeatable",
        "required": true,
        "editable": true,
        "deletable": false,
        "repeatable": true,
        "min_items": 1,
        "children": [
          {
            "field_key": "video_asset_key",
            "label": "资产键",
            "type": "text",
            "required": true,
            "editable": false,
            "deletable": false
          },
          {
            "field_key": "video_asset_type",
            "label": "资产类型",
            "type": "enum",
            "required": true,
            "editable": false,
            "deletable": false,
            "options": [
              {
                "value": "character",
                "label": "人物"
              },
              {
                "value": "scene",
                "label": "场景"
              },
              {
                "value": "prop",
                "label": "道具"
              },
              {
                "value": "creature",
                "label": "生物"
              }
            ]
          },
          {
            "field_key": "video_asset_name",
            "label": "语义名称",
            "type": "text",
            "required": true,
            "editable": true,
            "deletable": false
          },
          {
            "field_key": "video_asset_identity_key",
            "label": "基础身份键",
            "type": "text",
            "required": true,
            "editable": false,
            "deletable": false
          },
          {
            "field_key": "video_asset_source_scene_keys",
            "label": "来源场次",
            "type": "list",
            "required": true,
            "editable": false,
            "deletable": false
          },
          {
            "field_key": "video_asset_source_beat_keys",
            "label": "来源节拍",
            "type": "list",
            "required": true,
            "editable": false,
            "deletable": false
          },
          {
            "field_key": "video_asset_usage",
            "label": "用途",
            "type": "rich_text",
            "required": true,
            "editable": true,
            "deletable": false
          },
          {
            "field_key": "video_asset_description",
            "label": "外观与状态",
            "type": "rich_text",
            "required": true,
            "editable": true,
            "deletable": false
          },
          {
            "field_key": "video_asset_framing_rule",
            "label": "默认构图",
            "type": "rich_text",
            "required": true,
            "editable": true,
            "deletable": false
          },
          {
            "field_key": "video_asset_target_slot",
            "label": "目标槽位",
            "type": "text",
            "required": true,
            "editable": false,
            "deletable": false
          }
        ]
      },
      {
        "field_key": "asset_category_summary",
        "label": "四类汇总",
        "type": "group",
        "required": true,
        "editable": false,
        "deletable": false,
        "children": [
          {
            "field_key": "character_asset_keys",
            "label": "人物",
            "type": "list",
            "required": true,
            "editable": false,
            "deletable": false
          },
          {
            "field_key": "scene_asset_keys",
            "label": "场景",
            "type": "list",
            "required": true,
            "editable": false,
            "deletable": false
          },
          {
            "field_key": "prop_asset_keys",
            "label": "道具",
            "type": "list",
            "required": true,
            "editable": false,
            "deletable": false
          },
          {
            "field_key": "creature_asset_keys",
            "label": "生物",
            "type": "list",
            "required": true,
            "editable": false,
            "deletable": false
          }
        ]
      },
      {
        "field_key": "asset_deduplication_notes",
        "label": "去重与变体说明",
        "type": "rich_text",
        "required": true,
        "editable": false,
        "deletable": false
      }
    ]
  }
}
